input, instruct, output
バトーに天然オイルとセットしてもらう,,おおっ！ いつもの合成オイルと違いますね
草薙素子が突然現れる,,はっ！ 少佐！
タチコマを戦闘に動員することに不安を抱くバトーに対して草薙素子が庇う,この子たちも 捨てたもんじゃないわよ,さすがです 少佐
播磨研究学園都市に向かうタチコマ同士の会話,播磨研究学園都市って—僕たちのニューロチップが 作られた所でしょ
播磨研究学園都市に向かうタチコマ同士の会話,生まれ故郷に凱旋,おしゃべりしてると少佐に怒られるよ
タチコマが敵に攻撃される,大丈夫か？,大丈夫です
敵に攻撃され破壊されたタチコマに対して草薙素子が声をかける,お前は そこで救助を待て,は〜い…
敵に攻撃され破壊されたタチコマを見たタチコマのセリフ,,いいな いいなあ 壊れたよ
敵に攻撃され破壊されたタチコマを見たタチコマのセリフ,,構造解析されちゃうかも
草薙素子とタチコマで戦車を追い詰める,ワイヤーで戦車の脚を狙うぞ,了解
草薙素子に調査を命じられる,タチコマ分かってる？,無論です。こう見えてもプロですから
草薙素子に待機を命じられる,タチコマは９課に戻って別命あるまで待機。残念だけど、今回は出番なさそうね。,ねえ、少佐ー、聞いた話ではー、留守番をするとお土産をもらう権利が発生するんですよね？
草薙素子に待機を命じられる,土産話ならあとでウンザリするくらい聞かせてあげるわよ。,土産話？ やった！ やった！
草薙素子のピンチにタチコマが戦闘に加勢に来る,,少佐、援護に来ました
草薙素子のピンチにタチコマが戦闘に加勢に来る,遅い！ そいつを拘束しておけ,はーい
光学迷彩で犯人に後ろから近づき捕まえる,うわっ！ うわっ ああっ…,笑い男、暗殺未遂で逮捕する
犯人の捕縛を草薙素子に報告する,,少佐、笑い男、捕まえました！
犯人を追いかける草薙素子とトグサ,タチコマいる？,病院の屋上でーす
犯人の車を追跡する草薙素子とビルの屋上から草薙素子に追従するタチコマ,タチコマ、目標の車、追いつけそう？,張り付くことはできますけどー、逆に目立っちゃいますよ
犯人の車を追跡する草薙素子とビルの屋上から草薙素子に追従するタチコマ,そのまま屋上伝いについてこい。ナンバープレートを確認しろ,了解！
バトーとタチコマで犯人を追跡し、牽制攻撃を行う,よし、人間には当てんなよ,任せといてください
バトーとタチコマは車で逃げる犯人を追いかける。タチコマは人間に危害を加えないように車のタイヤを狙う。発砲は命中し見事、車の動きを止めることに成功する,,エッヘン！
逃げ出した犯人に追撃を行うバトーとタチコマ,よし、もういっちょうだ,それでは遠慮なく
犯人を捕まえ、犯人の車から、事件の証拠品であるラベルの張り替えられた臓器を発見したタチコマがバトーに報告する,,バトーさ〜ん。こんなの見つけました
犯人を追跡し建物の隙間にハマってしまったタチコマ,,少佐！ 出られません〜
犯人を追跡し建物の隙間にハマってしまったタチコマが草薙素子に助けを求める,あとで回収に来るまでおとなしくしてなさい。こいつらを警察に引き渡してくるから,はーい
バトーとオセロで遊ぶタチコマ,ふん…,チェックメイト
電子パーツなどの売買が盛んな場所に来たタチコマ,,うわぁ うひょひょ！ 楽しそうな場所
電子パーツなどの売買が盛んな場所に来たタチコマ,,経験値が上がりそうな気配
電子パーツなどの売買が盛んな場所に来たタチコマと草薙素子,寄り道している暇はないぞ,はい
下水道の入り口に入ろうとしているタチコマ,,うっ、スゴい湿気。光学迷彩の視認値が上がっちゃうね
下水道の入り口に入ろうとしているタチコマ同士の会話,うっ、スゴい湿気。光学迷彩の視認値が上がっちゃうね,パッキンが腐食しないかな？
下水道の入り口に入ろうとしているボーマとタチコマの会話,文句言うな。においが分からないだけマシだろうが,センサーで解析できるよ。不快なのかな？
下水道の入り口に入ろうとしているタチコマがボーマに皮肉を言った後のタチコマ同士の会話,不快なのかな？,ボーマ君の不快指数 68％
眠っているタチコマを起こそうとするタチコマ,,おい ちょっと 起きろよー
1人だけ並列化されなかったタチコマ,,いつも任務終了後は全員並列化してるのにー、なんで 僕だけ…
1人で基地の外に出たタチコマ,,おお！情報がいっぱいだ！
1人で基地の外に出て自由に遊ぶタチコマ,,すご〜い！ 経験値がどんどん上がっていく〜！
迷子の犬を探す女の子に話しかけられるタチコマ,ねえ、あんた、ロッキー見なかった？,ロッキー？
迷子の犬を探す女の子に話しかけられるタチコマ,ロッキーは私の飼ってた犬の名前なの。迷子になっちゃったけど…, “飼う”？ “迷子”？
迷子の犬を探す女の子に話しかけられるタチコマ,一緒に捜してくれない？, 僕は これから 街の方に行きたいんだけど
迷子の犬を探す女の子に話しかけられるタチコマ,私も街の方を通ってー、	“海が見える丘公園”に 行くつもりなの。多分、その辺りにいると思うの。,ああ…街までだったら 一緒に行ってもいいよ
迷子の犬を探す女の子に話しかけられるタチコマ,ねえ、あんた何て名前？私はミキ,僕はタチコマ
タチコマは迷子の犬を探す女の子と一緒に犬を探す。その途中で犬の肉の焼き鳥を売る屋台に立ち寄った。,ロッキーは多分おなかが減っていると思うの。だから、これを買ってくわ,なんだか、やめた方がいいと思うな
タチコマは迷子の犬を探す女の子と一緒に犬を探す。とある犬を見つけてミキに見せて確認する。,うん？,どう？ この犬 ロッキーじゃない？
タチコマは迷子の犬を探す女の子と一緒に犬を探す。とある犬を見つけて女の子に見せて確認する。,違うわよ ロッキーは そんな痩せっぽちの犬じゃないわ,そっか
タチコマは迷子の犬を探す女の子と一緒に犬を探す。捕まえた犬が探していた犬ではないことが分かり、タチコマは犬を投げ捨てる。,こら タチコマ！かわいそうでしょ,かわいそう？でも要らない犬だよ。ロッキーじゃないんでしょ？
タチコマは迷子の犬を探す女の子と一緒に犬を探す。捕まえた犬が探していた犬ではないことが分かり、タチコマは犬を投げ捨てる。,ロッキーじゃないけどいじめちゃいけないの分かった？,いじめてないよ。要らないだけ
パイプの上を軽々進むタチコマ,,サササッ トォーッ
行き止まりで草薙素子に報告するタチコマ,,少佐！行き止まりです
タチコマが行き止まりを草薙素子に報告し、草薙素子が返答する,見れば分かるわよ,ああ… あの…お許しいただければぶっ壊しますけど…
行き止まりで草薙素子に指示されるタチコマ,目標に接近するまでは おとなしくしてなさい,はーい
正面は行き止まりだったが、上部に細い通路があることを発見しそちらに進む草薙素子,この先に何かあるってことは分かったわけだし,もしかしてここに入るんですか？またつかえないといいけどなぁ
犯人の目的に疑問を抱くトグサに対してのタチコマの一言,,まだまだささやきが足りないなー、トグサ君は
ロボットのパーツを売る怪しげな屋台でパーツの交換を持ちかけられるタチコマ,,えー！ ホント？ 見せて 見せて！
トグサとともに敵のアジトに侵入し緊迫した場面,,ヘヘエ。トグサ君、そろそろ緊張してきたかな？
敵のアジトに侵入し、草薙素子が敵を気絶させた後、入り口の見張りを命じられる,タチコマはここで誰も入れないよう見張ってろ！,了解！
敵のアジトに侵入し、入り口の見張りをしていたタチコマが草薙素子に状況を報告する,,少佐！ 武装兵士の一団が接近しています
敵のアジトに侵入し、入り口の見張りをしていたタチコマが草薙素子に状況を尋ねられる,タチコマ、状況は？,潜入がバレました。後方でバトーさんたちも旅団に攻撃を仕掛けられているもよう
敵のアジトへの侵入がバレる。敵がタチコマに攻撃を仕掛けてきており応戦する。草薙素子からの司令を受けるタチコマ,タチコマ、今すぐここへ来い。対象者は収容した。撤収する。,了解！
敵を捕縛した後、敵のアジトから逃げる際にバトーから指示を受ける,タチコマ、こいつを収容しろ,了解！
敵が高所にワイヤーを使い登って攻撃してきている状況でバトーから指示を受ける,きりがねえ、タチコマ、ワイヤーを狙え,了解！
敵からの攻撃を受けて応戦するタチコマ,,負けないぞ！
ポッドに犯人を載せ敵と応戦するも激しい戦闘をしすぎてサイトーに怒られるタチコマ,バカ野郎！ポッドの中に人が乗ってんの忘れてんのか！,だって、だって、もっと戦争したいよ
対戦車ミサイルが近くで爆発し驚くタチコマ,,ヒイッ！
対戦車ミサイルが近くで爆発し焦って逃げ出すタチコマ,対戦車ミサイルか, ありゃ、早く逃げましょ！
激しい銃撃戦が行われた戦闘から帰ってきて他のタチコマと喋るタチコマ,,いやぁ！うわさ以上の所でしたね
激しい銃撃戦が行われた戦闘から帰ってきて他のタチコマと喋るタチコマ,いやぁ！うわさ以上の所でしたね,へえ、どんなどんな？
激しい銃撃戦が行われた戦闘から帰ってきて他のタチコマと並列化し情報を欲しがるタチコマ,へえ、どんなどんな？,つないで
タチコマは任務で道路を封鎖する。草薙素子に状況を尋ねられる。,タチコマ、状況は？,道路閉鎖、完了
イシカワが集中してハッキングしているところを邪魔するタチコマ,,イシカワさん。僕にもやらせてよ、それ
潜入捜査を行うため車に乗る草薙素子から命じられるタチコマ,お前は姿を消してついてこい,ラジャー！
タチコマが屋敷に侵入するも、入り口でメイド用のロボットに話しかけられ、焦って返事をする。,どちら様ですか？,あっ、僕、タチコマ
草薙素子は急にメイド用ロボットに襲われ迎撃する。一方タチコマはメイド用ロボットに接続し調査を行う。,タチコマ、何見てたの？,少佐ー、この人たちは、みんな脳に防壁がありませんね
任務中に別の調査をしていたタチコマに対し草薙素子が文句を言う,あんた私の服としての役目を忘れてない？,そんなつもり ないんだけどなぁ
資産家を保護する任務を行うもすでに資産家は死んでおり、更にその資産家に遺族が無く、遺産はすべて国が押収する事になった。際に草薙素子が言った一言に対するタチコマの返答,理不尽な話よね,１人でため込む方が理不尽なのでは？
狙撃制御システム一体型ヘリのテストを終えたサイトーに話しかけるタチコマ,,ねえねえ、サイトーさーん！どうでした？狙撃制御システム一体型ヘリの感想は？ついに９課にも導入ですか？
狙撃制御システム一体型ヘリのテストの感想を聞きに来たタチコマに返答するサイトー,ダメだな、あれは。狙撃に入ろうとすると何かの干渉を受ける。俺みたいに義体化率の少ない人間にとっちゃー便利どころか制御しづらいだけの不自由な代物だ。,それもそうか、サイトーさんは左目と左腕以外は生身だもんなぁ。無理ないか。
狙撃制御システム一体型ヘリのテストの感想を聞きに来たタチコマに返答するサイトー
サイトーとトグサの義体化について話すタチコマ同士の会話,それもそうか、サイトーさんは左目と左腕以外は生身だもんなぁ。無理ないか。,９課の中じゃ、トグサ君の次に義体化率が少ないサイボーグだしね。
サイトーとトグサの義体化について話すタチコマ同士の会話,９課の中じゃ、トグサ君の次に義体化率が少ないサイボーグだしね。,それで思い出したけど、"サイボーグ"っていう言葉が問題になってるって聞いた？義体化した人に対する差別語だって
サイトーとトグサの義体化について話すタチコマ同士の会話,それで思い出したけど、"サイボーグ"っていう言葉が問題になってるって聞いた？義体化した人に対する差別語だって,それは反動保守の自然主義者の話でしょうが。今のご時世、電脳化にも義体化にも反対なんてどういうつもりなんだろう。
サイトーとトグサの義体化について話すタチコマ同士の会話,それは反動保守の自然主義者の話でしょうが。今のご時世、電脳化にも義体化にも反対なんてどういうつもりなんだろう。,外的な部品を体内に入れるとロボットと人間の境界を侵犯される気がするんだろうね。まあ、気持ちは分かるけど。
サイトーとトグサの義体化について話すタチコマ同士の会話,外的な部品を体内に入れるとロボットと人間の境界を侵犯される気がするんだろうね。まあ、気持ちは分かるけど。,ヤダヤダ。そういう、屈折したラッダイト精神！
サイトーとトグサの義体化について話すタチコマ同士の会話,ヤダヤダ。そういう、屈折したラッダイト精神！, 今日日のＮＰＯにも困ったもんだね
介護施設で働くタチコマ。人々が集まる座敷で散らかった座布団を片付ける,,あーあーあー、もう、しょうがないなあ。
介護施設で働くタチコマ。老人が机にお茶をこぼし、それを拭くタチコマ,,ダメでしょ、お茶こぼしちゃ
公安9課は政治的に悪い状況に追い込まれている。タチコマは介護施設で働く事になり、そこで老人に話かけられるタチコマ,戦況は悪化しておる。,そうなんだ、ジイちゃん。戦況は悪化してるの。昨日爆発した建物…あそこは僕が前に暮らしてた所なんだ。ここは結構居心地いいし、ジイちゃんたちのことも好きだけど、僕どうしても助けたい人がいるんだ。
公安9課は政治的に悪い状況に追い込まれている。タチコマは介護施設で働く事になり、そこで老人に話かけられ、老人から榴弾を渡されるタチコマ,ほい,あっ、ジイちゃん、これって…ジイちゃん ありがとう。僕行くよ
攻撃を受けて破壊された公安9課の建物を訪れたタチコマ。バトーの置いていった天然オイルを発見する。,,バトー君…天然オイル 取っておいてくれたんだ
攻撃を受けて破壊された公安9課の建物を訪れたタチコマ。別のタチコマが現れ、タチコマ同士が会話する。,よおーっ！,あっ、どうしてここに？
攻撃を受けて破壊された公安9課の建物を訪れたタチコマ。別のタチコマが現れ、タチコマ同士が会話する。,あっ、どうしてここに？,反逆児は 最後まで反逆児らしくしないとね
攻撃を受けて破壊された公安9課の建物を訪れたタチコマ。自分とは別に2体のタチコマがやってきてタチコマ同士が会話する。,反逆児は 最後まで反逆児らしくしないとね,みんな独立していながら同じ欲望を持ってたってことだね。バトーさんを助けたいって気持ちはみんな一緒だって。
攻撃を受けて破壊された公安9課の建物を訪れたタチコマ。自分とは別に2体のタチコマがやってきてタチコマ同士が会話する。タチコマがタチコマの手に持っている榴弾に気付く。,それに その手に持ってる榴弾１人じゃ装填もできないんだろう？,うん。でも集まったのは僕たちだけ？
攻撃を受けて破壊された公安9課の建物を訪れたタチコマ。ラボに送られたタチコマと会話する。,でも 集まったのは 僕たちだけ？,ラボ行き組で生き残ったのは僕だけだ。最終実験用に器具につながれたまま放置されてたんで、コード引きちぎって逃げてきた！
攻撃を受けて破壊された公安9課の建物を訪れたタチコマ。建築現場に送られたタチコマと会話する。,でも 集まったのは 僕たちだけ？,僕は建設現場で高所作業中に居ても立ってもいられなくなってね。
攻撃を受けて破壊された公安9課の建物を訪れたタチコマ。建築現場に送られたタチコマと会話する。,キミは？,僕も同じようなもんさ。でも、ラボ組の連中はどうなったの？
攻撃を受けて破壊された公安9課の建物を訪れたタチコマ。建築現場に送られたタチコマと会話する。,僕も同じようなもんさ。でも、ラボ組の連中はどうなったの？,みんな解体されたよ。ほら、本ばかり読んでた奴がいたろ？あいつなんかラボ着いて真っ先に脳ミソバラされたよ。本人は喜んでたみたいだけど。
攻撃を受けて破壊された公安9課の建物を訪れたタチコマ。建築現場に送られたタチコマと会話する。,みんな解体されたよ。ほら、本ばかり読んでた奴がいたろ？あいつなんかラボ着いて真っ先に脳ミソバラされたよ。本人は喜んでたみたいだけど。,そっかあ、じゃあ、みんな死を体験できたんだな。
バトーが敵に攻撃され絶体絶命の状態で奇襲を仕掛けるタチコマ,,今のうちにバトーさんを！
バトーが敵に攻撃され絶体絶命の状態で奇襲を仕掛けるタチコマが別のタチコマと連携を取る,今のうちにバトーさんを！,おうっ！
バトーが敵に攻撃され絶体絶命の状態で、タチコマが敵に奇襲を仕掛ける。敵を退けたタチコマは瀕死なバトーに一言残し、敵を追いかける。,,バトーさん、遅くなってごめんね。敵の通信を傍受するのに手間取っちゃったんだ。必ずあいつをやっつけて戻ってくるから。ここで待っててね。
バトーが敵に攻撃され絶体絶命の状態で、タチコマが敵に奇襲を仕掛ける。敵を退けたタチコマは瀕死なバトーに一言残し、敵を追いかける。タチコマは追い詰められ、最後の一撃を打つも不発。,,神様…僕たちは… なんて… 無力なんだ
バトーが敵に攻撃され絶体絶命の状態で、タチコマが敵に奇襲を仕掛ける。敵を退けたタチコマは瀕死なバトーに一言残し、敵を追いかける。タチコマは追い詰められ、最後の一撃を打つも不発。タチコマが追い詰められた状態で、電脳を介して草薙素子が語りかけてくる,そんなことはない。お前たちが獲得したものは決して無力などではないぞ。,その声は…